{"$schema":"https://json-schema.org/draft/2020-12/schema","type":"object","required":["authority_version","source_classes","events"],"additionalProperties":false,"properties":{"authority_version":{"type":"integer"},"generated_for":{"type":"string"},"source_classes":{"type":"array","minItems":1,"uniqueItems":true,"items":{"type":"string","minLength":1}},"events":{"type":"array","items":{"type":"object","required":["event","sources"],"additionalProperties":false,"properties":{"event":{"type":"string","minLength":1},"sources":{"type":"object","required":["claude-code","codex-worker"],"additionalProperties":false,"properties":{"claude-code":{"$ref":"#/$defs/source"},"codex-worker":{"$ref":"#/$defs/source"}}}}}}},"$defs":{"source":{"type":"object","required":["source_class","source"],"additionalProperties":false,"properties":{"source_class":{"type":"string","minLength":1},"source":{"type":"string","minLength":1}}}}}
